{
  "schema_version": "1.0.0",
  "product": {
    "id": "what-happened-on-this-day-math",
    "month": "october",
    "version": "v1.0"
  },
  "pdf": {
    "path": "output/pdf/october-worksheet-packet.pdf",
    "sha256": "fe9d271700296c85cfb8b34bc08e54c4b808db2d4097d0d8db427ce05f0c3c20",
    "page_count": 127
  },
  "templates": {
    "cover": { "output": "output/thumbnails/october-v1.0-cover.png" },
    "whats_included": {
      "output": "output/thumbnails/october-v1.0-whats-included.png",
      "source_pages": { "story": 1, "level1": 2, "level2": 3, "level3": 4, "answer_key": 125 }
    },
    "different_math": {
      "output": "output/thumbnails/october-v1.0-different-math.png",
      "source_pages": { "story": 1, "level1": 2, "level2": 3, "level3": 4 }
    },
    "daily_practice": {
      "output": "output/thumbnails/october-v1.0-daily-practice.png",
      "source_pages": { "worksheet": 2 }
    },
    "landing_page": {
      "output": "output/thumbnails/october-v1.0-landing-page.png",
      "source_pages": { "reading_passage": 1, "level1": 2, "level2": 3, "level3": 4, "answer_key": 125 }
    }
  }
}
